{
	"version": "309.53.1581239136",
	"format": "1",
	"mod": {
		"id": "1934081600",
		"tag": "SoloFarmAnky",
		"title": "Solo Farm Mod"
	},
	"species": [
		{
			"name": "Ankylosaurus",
			"blueprintPath": "/Game/Mods/SoloFarmAnky/SFA_Anky/Ankylo_Character_BP.Ankylo_Character_BP_C",
			"dinoNameTag": "Anky",
			"customTag": "Anky",
			"targetingTeamName": "Herbivores",
			"mass": 300,
			"dragWeight": 160,
			"flags": [
				"allowMountedWeaponry",
				"allowRiding",
				"canBeDragged",
				"canBeTorpid",
				"canDrag"
			],
			"falling": {
				"dmgMult": 80,
				"maxSpeed": 1550
			},
			"movementW": {
				"walk": { "base": 120, "sprint": 264 }
			},
			"movementD": {
				"walk": { "base": 120, "sprint": 264 }
			},
			"attack": {
				"defaultDmg": 50,
				"defaultSwingRadius": 370,
				"attacks": [
					{ "name": "WalkingAndSwimmingTail", "interval": 0.67, "dmg": 50, "radius": 370, "stamina": 0 },
					{ "name": "Bite", "interval": 0.67, "dmg": 30, "radius": 250, "stamina": 0 },
					{ "name": "NotWalkingNotSwimmingTailAttack", "interval": 0.67, "dmg": 50, "radius": 370, "stamina": 0 }
				]
			}
		},
		{
			"name": "Aberrant Ankylosaurus",
			"blueprintPath": "/Game/Mods/SoloFarmAnky/SFA_Anky/Ankylo_Character_BP_Aberrant.Ankylo_Character_BP_Aberrant_C",
			"dinoNameTag": "Anky",
			"customTag": "Anky",
			"targetingTeamName": "Herbivores",
			"mass": 300,
			"dragWeight": 160,
			"flags": [
				"allowMountedWeaponry",
				"allowRiding",
				"canBeDragged",
				"canBeTorpid",
				"canDrag"
			],
			"falling": {
				"dmgMult": 80,
				"maxSpeed": 1550
			},
			"movementW": {
				"walk": { "base": 120, "sprint": 264 }
			},
			"movementD": {
				"walk": { "base": 120, "sprint": 264 }
			},
			"attack": {
				"defaultDmg": 50,
				"defaultSwingRadius": 370,
				"attacks": [
					{ "name": "WalkingAndSwimmingTail", "interval": 0.67, "dmg": 50, "radius": 370, "stamina": 0 },
					{ "name": "Bite", "interval": 0.67, "dmg": 30, "radius": 250, "stamina": 0 },
					{ "name": "NotWalkingNotSwimmingTailAttack", "interval": 0.67, "dmg": 50, "radius": 370, "stamina": 0 }
				]
			}
		}
	]
}