{
	"version": "309.53.1548344384",
	"format": "1",
	"mod": {
		"id": "1633860796",
		"tag": "DE_Breedable_RockDrakes",
		"title": "Dark Edges Breedable Rock Drakes"
	},
	"species": [
		{
			"name": "Rock Drake",
			"blueprintPath": "/Game/Mods/DE_Breedable_RockDrakes/Dinos/RockDrakes/RockDrake_Character_BP_DE.RockDrake_Character_BP_DE_C",
			"dinoNameTag": "RockDrake",
			"customTag": "RockDrake",
			"targetingTeamName": "Carnivores_High",
			"mass": 345,
			"dragWeight": 425,
			"flags": [
				"allowMountedWeaponry",
				"allowRiding",
				"canBeDragged",
				"canBeTorpid",
				"doStepDamage",
				"isCarnivore",
				"preventNeuter"
			],
			"falling": {
				"dmgMult": 10,
				"maxSpeed": 1550
			},
			"movementW": {
				"walk": { "base": 520, "sprint": 1820 },
				"swim": { "base": 480 }
			},
			"movementD": {
				"walk": { "base": 585, "sprint": 2047.5 },
				"swim": { "base": 540 }
			},
			"attack": {
				"defaultDmg": 0,
				"defaultSwingRadius": 600,
				"attacks": [
					{ "name": "Bite", "interval": 0.5, "dmg": 60, "radius": 600, "stamina": 20 },
					{ "name": "Toggle Climbing", "interval": 0, "dmg": 0, "radius": 0, "stamina": 0 },
					{ "name": "Toggle Camo", "interval": 0, "dmg": 0, "radius": 0, "stamina": 0 },
					{ "name": "Pounce_DirectHit", "interval": 0, "dmg": 240, "radius": 0, "stamina": 0 },
					{ "name": "Pounce_AOE", "interval": 0, "dmg": 150, "radius": 0, "stamina": 0 },
					{ "name": "Bite (Climbing)", "interval": 0.5, "dmg": 60, "radius": 900, "stamina": 20 }
				]
			}
		}
	]
}