{
	"version": "305.13.1579616448",
	"format": "1",
	"mod": {
		"id": "1522327484",
		"tag": "Additions_Pack",
		"title": "ARK Additions!"
	},
	"species": [
		{
			"name": "Acrocanthosaurus",
			"blueprintPath": "/Game/Mods/Additions_Pack/Acrocanthosaurus/Dinos/Acrocanthosaurus_Character_BP.Acrocanthosaurus_Character_BP_C",
			"dinoNameTag": "Acro",
			"customTag": "Acro",
			"targetingTeamName": "Carnivores_High",
			"mass": 450,
			"dragWeight": 550,
			"flags": [
				"allowRiding",
				"canBeDragged",
				"canBeTorpid",
				"canDrag",
				"doStepDamage",
				"isBigDino",
				"isCarnivore"
			],
			"falling": {
				"dmgMult": 80,
				"maxSpeed": 1550
			},
			"movementW": {
				"walk": { "base": 520, "sprint": 1144 }
			},
			"movementD": {
				"walk": { "base": 650, "sprint": 1430 }
			},
			"attack": {
				"defaultDmg": 0,
				"defaultSwingRadius": 90,
				"attacks": [
					{ "name": "Bite", "interval": 0.5, "dmg": 55, "radius": 400, "stamina": 0 },
					{ "name": "Shield Stance", "interval": 0, "dmg": 0, "radius": 0, "stamina": 0 },
					{ "name": "Stomp", "interval": 15, "dmg": 95, "radius": 800, "stamina": 7 },
					{ "name": "ShieldBash", "interval": 0, "dmg": 20, "radius": 800, "stamina": 0 },
					{ "name": "Roar", "interval": 0, "dmg": 0, "radius": 0, "stamina": 0 },
					{ "name": "AdrenalineBite", "interval": 2, "dmg": 55, "radius": 400, "stamina": 0 }
				]
			}
		},
		{
			"name": "Archelon",
			"blueprintPath": "/Game/Mods/Additions_Pack/Archelon/Dinos/Archelon_Character_BP.Archelon_Character_BP_C",
			"dinoNameTag": "Archelon",
			"customTag": "Archelon",
			"targetingTeamName": "Carnivores_High",
			"mass": 350,
			"dragWeight": 550,
			"flags": [ "allowMountedWeaponry", "allowRiding", "canBeDragged", "isBigDino" ],
			"falling": {
				"dmgMult": 80,
				"maxSpeed": 1550
			},
			"movementW": {
				"walk": { "base": 200, "sprint": 300 }
			},
			"movementD": {
				"walk": { "base": 200, "sprint": 300 }
			},
			"attack": {
				"defaultDmg": 0,
				"defaultSwingRadius": 90,
				"attacks": [ { "name": "None", "interval": 1, "dmg": 25, "radius": 400, "stamina": 0 } ]
			}
		},
		{
			"name": "Brachiosaurus",
			"blueprintPath": "/Game/Mods/Additions_Pack/Brachiosaurus/Dinos/Brachiosaurus_Character_BP.Brachiosaurus_Character_BP_C",
			"dinoNameTag": "AdditionsBrachio",
			"customTag": "AdditionsBrachio",
			"targetingTeamName": "Herbivores_Large",
			"mass": 750,
			"dragWeight": 3000,
			"flags": [
				"allowRiding",
				"canBeDragged",
				"canBeTorpid",
				"canDrag",
				"doStepDamage",
				"isBigDino"
			],
			"falling": {
				"dmgMult": 80,
				"maxSpeed": 1550
			},
			"movementW": {
				"walk": { "base": 287.5, "sprint": 575 }
			},
			"movementD": {
				"walk": { "base": 250, "sprint": 500 }
			},
			"attack": {
				"defaultDmg": 0,
				"defaultSwingRadius": 90,
				"attacks": [
					{ "name": "FrontStomps", "interval": 1.5, "dmg": 110, "radius": 700, "stamina": 30 },
					{ "name": "BackStomps", "interval": 1, "dmg": 95, "radius": 700, "stamina": 20 },
					{ "name": "ChangeStance", "interval": 0, "dmg": 0, "radius": 100, "stamina": 15 },
					{ "name": "Bellow", "interval": 0, "dmg": 1, "radius": 1500, "stamina": 150 },
					{ "name": "MegaStomp", "interval": 0, "dmg": 2000, "radius": 1700, "stamina": 0 }
				]
			}
		},
		{
			"name": "Aberrant Brachiosaurus",
			"blueprintPath": "/Game/Mods/Additions_Pack/Brachiosaurus/Dinos/Brachiosaurus_Character_BP_Aberrant.Brachiosaurus_Character_BP_Aberrant_C",
			"dinoNameTag": "AdditionsBrachio",
			"customTag": "AdditionsBrachio",
			"targetingTeamName": "Herbivores_Large",
			"mass": 750,
			"dragWeight": 3000,
			"flags": [
				"allowRiding",
				"canBeDragged",
				"canBeTorpid",
				"canDrag",
				"doStepDamage",
				"isBigDino"
			],
			"falling": {
				"dmgMult": 80,
				"maxSpeed": 1550
			},
			"movementW": {
				"walk": { "base": 287.5, "sprint": 575 }
			},
			"movementD": {
				"walk": { "base": 250, "sprint": 500 }
			},
			"attack": {
				"defaultDmg": 0,
				"defaultSwingRadius": 90,
				"attacks": [
					{ "name": "FrontStomps", "interval": 1.5, "dmg": 110, "radius": 700, "stamina": 30 },
					{ "name": "BackStomps", "interval": 1, "dmg": 95, "radius": 700, "stamina": 20 },
					{ "name": "ChangeStance", "interval": 0, "dmg": 0, "radius": 100, "stamina": 15 },
					{ "name": "Bellow", "interval": 0, "dmg": 1, "radius": 1500, "stamina": 150 },
					{ "name": "MegaStomp", "interval": 0, "dmg": 2000, "radius": 1700, "stamina": 0 }
				]
			}
		},
		{
			"name": "Deinosuchus",
			"blueprintPath": "/Game/Mods/Additions_Pack/Deinosuchus/Dino/Deinosuchus_Character_BP.Deinosuchus_Character_BP_C",
			"dinoNameTag": "Deino",
			"customTag": "Deino",
			"targetingTeamName": "Carnivores_High",
			"mass": 250,
			"dragWeight": 300,
			"flags": [
				"allowMountedWeaponry",
				"allowRiding",
				"canBeDragged",
				"canBeTorpid",
				"canDrag",
				"isAmphibious",
				"isBigDino",
				"isCarnivore"
			],
			"falling": {
				"dmgMult": 80,
				"maxSpeed": 1550
			},
			"movementW": {
				"walk": { "base": 202.5, "sprint": 303.8 }
			},
			"movementD": {
				"walk": { "base": 262.5, "sprint": 393.8 }
			},
			"attack": {
				"defaultDmg": 60,
				"defaultSwingRadius": 200,
				"attacks": [
					{ "name": "Bite", "interval": 1, "dmg": 50, "radius": 350, "stamina": 0 },
					{ "name": "GashBite", "interval": 5, "dmg": 70, "radius": 350, "stamina": 20 },
					{ "name": "TailSwing", "interval": 0, "dmg": 5, "radius": 400, "stamina": 5 },
					{ "name": "Bite", "interval": 1, "dmg": 50, "radius": 350, "stamina": 0 },
					{ "name": "Right-Bite", "interval": 1, "dmg": 50, "radius": 350, "stamina": 0 }
				]
			}
		},
		{
			"name": "Aberrant Deinosuchus",
			"blueprintPath": "/Game/Mods/Additions_Pack/Deinosuchus/Dino/Deinosuchus_Character_BP_Aberrant.Deinosuchus_Character_BP_Aberrant_C",
			"dinoNameTag": "Deino",
			"customTag": "Deino",
			"targetingTeamName": "Carnivores_High",
			"mass": 250,
			"dragWeight": 300,
			"flags": [
				"allowMountedWeaponry",
				"allowRiding",
				"canBeDragged",
				"canBeTorpid",
				"canDrag",
				"isAmphibious",
				"isBigDino",
				"isCarnivore"
			],
			"falling": {
				"dmgMult": 80,
				"maxSpeed": 1550
			},
			"movementW": {
				"walk": { "base": 202.5, "sprint": 303.8 }
			},
			"movementD": {
				"walk": { "base": 262.5, "sprint": 393.8 }
			},
			"attack": {
				"defaultDmg": 60,
				"defaultSwingRadius": 200,
				"attacks": [
					{ "name": "Bite", "interval": 1, "dmg": 50, "radius": 350, "stamina": 0 },
					{ "name": "GashBite", "interval": 5, "dmg": 70, "radius": 350, "stamina": 20 },
					{ "name": "TailSwing", "interval": 0, "dmg": 5, "radius": 400, "stamina": 5 },
					{ "name": "Bite", "interval": 1, "dmg": 50, "radius": 350, "stamina": 0 },
					{ "name": "Right-Bite", "interval": 1, "dmg": 50, "radius": 350, "stamina": 0 }
				]
			}
		},
		{
			"name": "Xiphactinus",
			"blueprintPath": "/Game/Mods/Additions_Pack/Xiphactinus/Dino/Xiph_Character_BP.Xiph_Character_BP_C",
			"dinoNameTag": "Xiph",
			"customTag": "Xiph",
			"targetingTeamName": "Carnivores_Large",
			"mass": 200,
			"dragWeight": 250,
			"flags": [
				"allowRiding",
				"canBeDragged",
				"canBeTorpid",
				"isCarnivore",
				"isWaterDino"
			],
			"falling": {
				"dmgMult": 80,
				"maxSpeed": 1550
			},
			"movementW": {
				"swim": { "base": 675 }
			},
			"movementD": {
				"swim": { "base": 1346.4 }
			},
			"attack": {
				"defaultDmg": 20,
				"defaultSwingRadius": 200,
				"attacks": [ { "name": "Bite", "interval": 0.55, "dmg": 23, "radius": 200, "stamina": 0 } ]
			}
		}
	]
}