{
	"$schema": "../.schema/species.json",
	"version": "310.77.1505566966",
	"format": "1",
	"mod": {
		"id": "1136390783",
		"tag": "PhoenixBreeding",
		"title": "Phoenix Breeding"
	},
	"species": [
		{
			"name": "Phoenix",
			"blueprintPath": "/Game/Mods/PhoenixBreeding/Phoenix/Phoenix_Character_BP_Breedable.Phoenix_Character_BP_Breedable_C",
			"dinoNameTag": "Phoenix",
			"customTag": "Phoenix",
			"targetingTeamName": "Herbivores",
			"mass": 190,
			"dragWeight": 35,
			"flags": [
				"allowRiding",
				"canBeDragged",
				"canDrag",
				"isCarnivore",
				"isFlyerDino"
			],
			"falling": {
				"dmgMult": 80,
				"maxSpeed": 1550
			},
			"movementW": {
				"walk": { "base": 364, "sprint": 637 },
				"fly": { "base": 840 },
				"swim": { "base": 420 }
			},
			"movementD": {
				"walk": { "base": 520, "sprint": 910 },
				"fly": { "base": 1200 },
				"swim": { "base": 600 }
			},
			"attack": {
				"defaultDmg": 14,
				"defaultSwingRadius": 185,
				"attacks": [
					{ "name": "Attack Bite", "interval": 0.6, "dmg": 14, "radius": 350, "stamina": 0 },
					{
						"name": "Fireball (Rider)", "interval": 4, "dmg": 0, "radius": 0, "stamina": 75,
						"isProjectile": true
					},
					{ "name": "Melee Rake", "interval": 1, "dmg": 23, "radius": 350, "stamina": 0 }
				]
			}
		}
	]
}