{
	"version": "305.13.1515901388",
	"format": "1",
	"mod": {
		"id": "1268749723",
		"tag": "ShadCore",
		"title": "Origin Manticore"
	},
	"species": [
		{
			"name": "Origin Manticore",
			"blueprintPath": "/Game/Mods/ShadCore/ShadCore_Character_bp.ShadCore_Character_bp_C",
			"dinoNameTag": "Manticore",
			"customTag": "Shadcore",
			"targetingTeamName": "Carnivores_High",
			"mass": 400,
			"dragWeight": 550,
			"flags": [
				"allowFlyerLandedRider",
				"allowMountedWeaponry",
				"allowRiding",
				"canBeDragged",
				"canBeTorpid",
				"canDrag",
				"flyerAllowRidingInCaves",
				"isBigDino",
				"isCarnivore",
				"isFlyerDino"
			],
			"falling": {
				"dmgMult": 80,
				"maxSpeed": 1550
			},
			"movementW": {
				"walk": { "base": 350, "sprint": 1750 },
				"fly": { "base": 700, "sprint": 560 },
				"swim": { "base": 300 }
			},
			"movementD": {
				"walk": { "base": 350, "sprint": 1750 },
				"fly": { "base": 700, "sprint": 560 },
				"swim": { "base": 300 }
			},
			"attack": {
				"defaultDmg": 45,
				"defaultSwingRadius": 300,
				"attacks": [
					{ "name": "BiteNomFury", "interval": 0.4, "dmg": 50, "radius": 280, "stamina": 0 },
					{ "name": "BiteNomFury", "interval": 5, "dmg": 80, "radius": 1600, "stamina": 500 },
					{ "name": "BiteNomFury", "interval": 0.4, "dmg": 46, "radius": 280, "stamina": 0 },
					{ "name": "BiteNomFury", "interval": 1, "dmg": 53, "radius": 340, "stamina": 0 },
					{ "name": "BiteNomFury", "interval": 0, "dmg": 0, "radius": 0, "stamina": 0 },
					{ "name": "BiteNomFury", "interval": 0, "dmg": 50, "radius": 300, "stamina": 0 }
				]
			}
		}
	]
}