{
	"version": "309.53.1519946967",
	"format": "1",
	"mod": {
		"id": "1270132511",
		"tag": "GiantGlowpets",
		"title": "Rideable Glowpets"
	},
	"species": [
		{
			"name": "Giant Featherlight",
			"blueprintPath": "/Game/Mods/GiantGlowpets/LanternBird/LanternBird_Character_BP_Giant.LanternBird_Character_BP_Giant_C",
			"dinoNameTag": "RideableLanternBird",
			"customTag": "RideableLanternBird",
			"targetingTeamName": "Herbivores",
			"mass": 80,
			"dragWeight": 100,
			"flags": [
				"allowFlyerLandedRider",
				"allowMountedWeaponry",
				"allowRiding",
				"canBeDragged",
				"canBeTorpid",
				"canDrag",
				"flyerAllowRidingInCaves",
				"isFlyerDino"
			],
			"falling": {
				"dmgMult": 60,
				"maxSpeed": 1550
			},
			"movementW": {
				"walk": { "base": 600, "sprint": 900 },
				"fly": { "base": 600 },
				"swim": { "base": 300 }
			},
			"movementD": {
				"walk": { "base": 600, "sprint": 900 },
				"fly": { "base": 600 },
				"swim": { "base": 300 }
			},
			"attack": {
				"defaultDmg": 36,
				"defaultSwingRadius": 350,
				"attacks": [
					{ "name": "BiteAttack", "interval": 0.6, "dmg": 36, "radius": 210, "stamina": 10 },
					{ "name": "BiteAttack", "interval": 0.6, "dmg": 74, "radius": 210, "stamina": 30 },
					{ "name": "SpeedBuff", "interval": 120, "dmg": 1, "radius": 1, "stamina": 100 }
				]
			}
		},
		{
			"name": "Giant Shinehorn",
			"blueprintPath": "/Game/Mods/GiantGlowpets/LanternGoat/LanternGoat_Character_BP_Giant.LanternGoat_Character_BP_Giant_C",
			"dinoNameTag": "RideableLanternGoat",
			"customTag": "RideableLanternGoat",
			"targetingTeamName": "Herbivores_Medium_Aggressive",
			"mass": 80,
			"dragWeight": 120,
			"flags": [ "allowMountedWeaponry", "allowRiding", "canBeDragged", "canBeTorpid" ],
			"falling": {
				"dmgMult": 60,
				"maxSpeed": 1550
			},
			"movementW": {
				"walk": { "base": 399, "sprint": 598.5 },
				"swim": { "base": 300 }
			},
			"movementD": {
				"walk": { "base": 399, "sprint": 598.5 },
				"swim": { "base": 300 }
			},
			"attack": {
				"defaultDmg": 30,
				"defaultSwingRadius": 125,
				"attacks": [
					{ "name": "Melee", "interval": 0.4, "dmg": 30, "radius": 110, "stamina": 15 },
					{ "name": "Melee", "interval": 0.4, "dmg": 90, "radius": 110, "stamina": 30 }
				]
			}
		},
		{
			"name": "Giant Glowtail",
			"blueprintPath": "/Game/Mods/GiantGlowpets/LanternLizard/LanternLizard_Character_BP_Giant.LanternLizard_Character_BP_Giant_C",
			"dinoNameTag": "RideableLanternLizard",
			"customTag": "RideableLanternLizard",
			"targetingTeamName": "Herbivores_Medium_Aggressive",
			"mass": 80,
			"dragWeight": 160,
			"flags": [
				"allowMountedWeaponry",
				"allowRiding",
				"canBeDragged",
				"canBeTorpid",
				"canDrag",
				"flyerAllowRidingInCaves"
			],
			"falling": {
				"dmgMult": 10,
				"maxSpeed": 1550
			},
			"movementW": {
				"walk": { "base": 600, "sprint": 900 },
				"swim": { "base": 600 }
			},
			"movementD": {
				"walk": { "base": 600, "sprint": 900 },
				"swim": { "base": 600 }
			},
			"attack": {
				"defaultDmg": 35,
				"defaultSwingRadius": 110,
				"attacks": [
					{ "name": "Melee", "interval": 0.5, "dmg": 60, "radius": 140, "stamina": 15 },
					{ "name": "Tongue", "interval": 10, "dmg": 6, "radius": 360, "stamina": 30 },
					{
						"name": "Spit", "interval": 12, "dmg": 0, "radius": 720, "stamina": 45,
						"isProjectile": true
					}
				]
			}
		},
		{
			"name": "Giant Bulbdog",
			"blueprintPath": "/Game/Mods/GiantGlowpets/LanternPug/LanternPug_Character_BP_Giant.LanternPug_Character_BP_Giant_C",
			"dinoNameTag": "RideablePug",
			"customTag": "RideableLanternPug",
			"targetingTeamName": "Herbivores_Medium_Aggressive",
			"mass": 95,
			"dragWeight": 145,
			"flags": [ "allowMountedWeaponry", "allowRiding", "canBeDragged", "canBeTorpid" ],
			"falling": {
				"dmgMult": 60,
				"maxSpeed": 1550
			},
			"movementW": {
				"walk": { "base": 420, "sprint": 630 },
				"swim": { "base": 300 }
			},
			"movementD": {
				"walk": { "base": 420, "sprint": 630 },
				"swim": { "base": 300 }
			},
			"attack": {
				"defaultDmg": 60,
				"defaultSwingRadius": 142,
				"attacks": [
					{ "name": "Melee", "interval": 0.4, "dmg": 60, "radius": 142, "stamina": 20 },
					{ "name": "Melee2", "interval": 0.8, "dmg": 30, "radius": 95, "stamina": 40 },
					{ "name": "AOEBuff", "interval": 120, "dmg": 1, "radius": 1, "stamina": 100 }
				]
			}
		}
	]
}